{"$schema":"https://json-schema.org/draft/2020-12/schema","additionalProperties":false,"properties":{"agent_id":{"type":"string"},"agent_kind":{"type":["string","null"]},"certification_state":{"additionalProperties":false,"properties":{"approval_token":{"type":["string","null"]},"approved_at":{"type":["string","null"]},"approved_by":{"type":["string","null"]},"certified":{"type":"boolean"},"certified_at":{"type":["string","null"]},"notes":{"type":["string","null"]},"schema_version":{"type":"integer"},"self_certification_hash":{"type":["string","null"]},"state":{"enum":["UNCERTIFIED","SELF_CERTIFIED_PENDING_USER_APPROVAL","USER_APPROVED_PENDING_SCRIPT","CERTIFIED"]}},"required":["schema_version","state","certified","certified_at","approved_at","approval_token","approved_by","self_certification_hash","notes"],"type":"object"},"created_at":{"type":"string"},"current_target":{"type":["string","null"]},"current_task_id":{"type":["string","null"]},"last_checkin_at":{"type":["string","null"]},"last_checkout_at":{"type":["string","null"]},"last_command":{"additionalProperties":false,"properties":{"args":{"items":{"type":"string"},"type":"array"},"name":{"type":"string"}},"required":["name","args"],"type":["object","null"]},"last_heartbeat_at":{"type":["string","null"]},"mode":{"type":"string"},"model_name":{"type":["string","null"]},"notes":{"type":["string","null"]},"runtime":{"type":["string","null"]},"schema_version":{"minimum":1,"type":"integer"},"status":{"enum":["active","inactive","stale"]},"updated_at":{"type":"string"}},"required":["schema_version","agent_id","created_at","updated_at","status","last_heartbeat_at","last_checkin_at","last_checkout_at","mode","current_task_id","current_target","notes","last_command","certification_state"],"title":"agent_profile","type":"object"}
