{"agent_id":"example","agent_kind":null,"certification_state":{"approval_token":null,"approved_at":null,"approved_by":null,"certified":false,"certified_at":null,"notes":null,"schema_version":1,"self_certification_hash":null,"state":"UNCERTIFIED"},"created_at":"1970-01-01T00:00:00Z","current_target":null,"current_task_id":null,"last_checkin_at":null,"last_checkout_at":null,"last_command":null,"last_heartbeat_at":null,"mode":"agent","model_name":null,"notes":null,"runtime":null,"schema_version":1,"status":"inactive","updated_at":"1970-01-01T00:00:00Z"}
